\# Program start time:     UTC 2025.10.14 15:24:29.862
\# Local time: UTC (UTC+00:00) 2025.10.14 15:24:29.862
\o Program:		@(#)$CDS: virtuoso version 6.1.8-64b 09/03/2024 19:11 (sjfhw316) $
\o Hierarchy:		/opt/tools/cadence/installs/IC618/tools.lnx86/dfII/
\o Sub version:		sub-version  IC6.1.8-64b.500.36  (64-bit addresses)
\# Command line:	/opt/tools/cadence/installs/IC618/tools.lnx86/dfII/bin/64bit/virtuoso -noautostart -mpssession virtuosoEZBv6X9wxTKyAu_dRvf85K_74483 -mpshost 33371@b35621b5a0f6 -davinciService DaVinciService_74677_1760445194 -log /home/saul/projects/LF_BG/logs_saul/logs2/Job175.log -licenseLockFileName /home/saul/projects/LF_BG/.tmp_saul/.b35621b5a0f6_74677 -interactiveA -interactiveE -interactiveRTT -nostdin -nographE -axlChildIdFlag 175
\# Host name (type):	b35621b5a0f6 (x86_64)
\# Operating system:	Linux 6.10.14-linuxkit #1 SMP PREEMPT_DYNAMIC Tue Apr 15 16:05:22 UTC 2025
\# Linux /etc/issue:	\S
\# Linux /etc/issue:	Kernel \r on an \m
\# X display name (WxH):	:4549 (1024x868)
\# Available geometry:			TL(0:0) BR(1023:867)
\# X server:			The X.Org Foundation
\# Depth of Visual (Root):	24 (24)
\# Number of Planes Used:	24
\# X version:		11.0 (vendor release 12011000)
\# X resource pool:	base 0x400000, mask 0x1fffff (2097151), shift 0
\# 			current id 0x0, current max 0x1ffffa (2097146)
\# Max data seg size:	     unlimited
\# Max process size:	     unlimited
\# Initial sbrk value:	      1,559 MB
\# Available memory:	     22,487 MB
\# System memory:	     28,093 MB
\# Maximum memory size:	     26,655 MB
\# Max mem available:	     22,607 MB
\# Initial memory used:	        121 MB
\#        process size:	      1,681 MB
\# Thread usage limits (effective/default):	maxthreads 4294967295/4294967295 maxload 16.00/16.00
\# Qt version:		5.9.1
\# Window Manager:	other
\# User Name:		saul
\o Working Directory:	b35621b5a0f6:/home/saul/projects/LF_BG
\# Process Id:		27736
\# Container Id:	EZBv6X9wxTKyAu_dRvf85K
\o 
\o COPYRIGHT (C) 1992-2024  CADENCE DESIGN SYSTEMS INC.  ALL RIGHTS RESERVED.
\o           (C) 1992-2024  UNIX SYSTEMS Laboratories INC.,
\o                          Reproduced with permission.
\o 
\o This Cadence Design Systems program and online documentation are
\o proprietary/confidential information and may be disclosed/used only
\o as authorized in a license agreement controlling such use and disclosure.
\o 
\o           RESTRICTED RIGHTS NOTICE (SHORT FORM)
\o Use/reproduction/disclosure is subject to restriction
\o set forth at FAR 1252.227-19 or its equivalent.
\o Loading geView.cxt 
\o Loading menuBuilder.cxt 
\o Loading schView.cxt 
\o Loading selectSv.cxt 
\o Loading pvsui.cxt
\o Loading wireEdit.cxt 
\o Loading pte2.cxt 
\o Loading xlUI.cxt 
\o Loading auCore.cxt 
\o Loading vhdl.cxt 
\o Loading seismic.cxt 
\o Loading ci.cxt 
\o Loading ams.cxt 
\o Loading oasis.cxt 
\o Loading analog.cxt 
\o Loading asimenv.cxt 
\o Loading dal.cxt 
\o Loading awv.cxt 
\o Loading socket.cxt 
\o Loading par.cxt 
\o Loading alvs.cxt 
\o Loading caa.cxt 
\o Loading amps.cxt 
\o Loading adexlCore.cxt 
\o Loading adexl.cxt 
\o *Info*    Exporting services from client ... 
\o 
\o Loading adexlDM.cxt 
\o Loading cpf.cxt 
\o Loading cli.cxt 
\o Loading lp.cxt 
\o INFO (ELI-00302) Connecting to parent process (session=virtuosoEZBv6X9wxTKyAu_dRvf85K_74483, host=33371@b35621b5a0f6). Connection mode is ICRP. Total timeout is 180 seconds. Connection timeout is 90 seconds.
\o INFO (ELI-00303) Step 1: Connecting to parent. Time spent is 0 seconds.
\o INFO (ELI-00304) The registration of the child 27736 within 90 seconds is being processed...
\o INFO (ELI-00305) The result of registration is true. Time spent is 0 seconds.
\o INFO (ELI-00308) The connection has ended. Result is true. Total time spent is 0 seconds.
\# [15:24:29.512441] Configured Lic search path (22.01-s002): 3000@lic08.ug.kth.se
\# Memory report: using         273 MB, process size 1,963 MB at UTC 2025.10.14 15:24:36.593
\w *WARNING* The directory: '/opt/pdk/lf11/PDK_LF11ISi_V1_3_2/tools/setup/$ASSURAHOME/tools/assura/etc/avtech/avTech' does not exist
\w 	but was defined in libFile '/opt/pdk/lf11/PDK_LF11ISi_V1_3_2/tools/setup/cds.lib' for Lib 'avTech'.
\o 
\o ----------------          LFoundry            ----------------
\o ----------------    Initializing LF11IS PDK    ----------------
\o ----------------        Version 1.3.2         ----------------
\o ----------------        Option 6metal         ----------------
\o *LF-INFO* Loading lf11is:/opt/pdk/lf11/PDK_LF11ISi_V1_3_2/analog/callbacks/lf11is_cdfCbks.il   done
\o *LF-INFO* lf11is libInit.il loaded successfully. 
\w *WARNING* Cannot find /opt/tools/cadence/installs/IC618/tools.lnx86/dfII/etc/tools/wavescan directory to load environment variables
\w *WARNING* envSetVal: could not find tool[.partition] 'wavescan.trace'
\w *WARNING* Cannot find /opt/tools/cadence/installs/IC618/tools.lnx86/dfII/etc/tools/wavescan directory to load environment variables
\w *WARNING* envSetVal: could not find tool[.partition] 'wavescan.trace'
\o *LF-INFO* .cdsinit: Loading project .cdsenv file       skipped
\o *LF-INFO* .cdsinit: Setting Spectre models                done
\o *LF-INFO* .cdsinit: Setting UltraSim models               done
\o *LF-INFO* .cdsinit: Setting AMS analog models             done
\o *LF-INFO* .cdsinit: Setting AMS netlist mode to OSS       done
\o *LF-INFO* .cdsinit: Setting HSpice models                 done
\o *LF-INFO* .cdsinit: Setting CDL out keys                  done
\o *LF-INFO* .cdsinit: Loading Ciranova abut function        done
\o *LF-INFO* .cdsinit: WiCkeD setup                       skipped
\o *LF-INFO* .cdsinit: Golden Gate setup                  skipped
\o *LF-INFO* .cdsinit: Loading default bindkeys              done
\o *LF-INFO* .cdsinit: PDF reader "evince" found: /bin/evince.
\o *LF-INFO* .cdsinit: Creating LF11IS PDK menus              done
\o *LF-INFO* .cdsinit: Loading LF11IS display.drf             done
\o *LF-INFO* .cdsinit: Setting PVS setup trigger      done
\o *LF-INFO* .cdsinit: Loading the user .cdsinit          skipped
\o *LF-INFO* .cdsinit: Loading ISO Ring utility              done
\o *LF-INFO* .cdsinit: Loading Layout Utilities              done
\o *LF-INFO* .cdsinit: Opening library manager 				  done
\o *Info*    Client has finished starting ... 
\o 
\o Loading vdsil.cxt 
\p > 
\w *WARNING* could not load font "-*-courier-medium-r-*-*-12-*", using font "fixed"
\# Loading perfDiag...
\# (PerfDiag): Set GDB path to environment variable 'gdbPath' (gdb).
\w *WARNING* (PerfDiag): The GDB command 'gdb' is not found or is invalid.
\w *WARNING* (PerfDiag): The GDB-related functionality has been disabled. Use the 'gdbPath' environment variable to set a valid GDB path or set one of the SHELL environment variables CDS_DEBUGGER, DEBUGGER, or GDB, and restart Virtuoso.
\# Performance Diagnostic tool is installed. You can access PerfDiag from CIW Tools or use the shell command 'cdsPerfDiag -p 27736' to open it when Virtuoso freezes.
\# (PerfDiag): Use backtrace from GLIBC.
\w *WARNING* _perfPstackCheck: Cannot find pstack/gstack. Please setup PATH environment variable to pstack/gstack executable.
\o Loading vqp.cxt 
\o Loading hdlPkg.cxt 
\o 
\o 
\o *Info*    Configuring the session ...
\o 
\o Loading simui.cxt 
\o 	Library      = BANDGAP
\o 	Cell         = BG_0_6_V3
\o 	View         = schematic
\o 	Simulator    = spectre
\o 	State Path   = $AXL_SETUPDB_DIR/test_states
\o 	State Name   = MC_BANDGAP:BG_0_8_V2:1:1_state_MonteCarlo.7
\o 	Results DB   = /home/saul/projects/LF_BG/BANDGAP/BG_0_6_V3/adexl/results/data/MonteCarlo.7.rdb
\o 	Results Dir  = /home/saul/simulation/BANDGAP/BG_0_6_V3/adexl/results/data/MonteCarlo.7/10/MC
\o 	Results Loc  = /home/saul/simulation/BANDGAP/BG_0_6_V3/adexl/results/data
\o 	Project Dir  = /home/saul/simulation
\o 	Setup DB loc = /home/saul/projects/LF_BG/BANDGAP/BG_0_6_V3/adexl
\o 	File Encoding = 0
\o 
\o 
\o Loading viva.cxt 
\w *WARNING* The directory: '/opt/pdk/lf11/PDK_LF11ISi_V1_3_2/tools/setup/$ASSURAHOME/tools/assura/etc/avtech/avTech' does not exist
\w 	but was defined in libFile '/opt/pdk/lf11/PDK_LF11ISi_V1_3_2/tools/setup/cds.lib' for Lib 'avTech'.
\o Loading spectrei.cxt 
\o Loading devCheck.cxt 
\o Loading relXpert.cxt 
\# Available memory:         19,930 MB at UTC 2025.10.14 15:24:40.523
\# Memory report: Maximum memory size now 20,283 MB at UTC 2025.10.14 15:24:40.523
\# Thread usage report: 22 active threads, active load 1.40 at UTC 2025.10.14 15:24:40.523
\o WARNING (ADE-7017): The Spectre run mode needs to be 'batch' when EM/IR analysis is enabled. Automatically setting the run mode to 'batch'.
\# Memory report: using         373 MB, process size 2,066 MB at UTC 2025.10.14 15:24:41.007
\o Loading hspiceD.cxt 
\o Loading spectreinl.cxt 
\o Loading msgHandler.cxt 
\o Loading UltraSim.cxt 
\o Loading AMSOSS.cxt 
\o Loading AMS.cxt 
\o 
\o *Info*    The auto suspension is disabled.
\o 
\o Loading monte.cxt 
\o 
\o 
\o 
\o 
\o 
\o *Info*    Run start for Point ID (3 19) on testbench [ MC ].
\o 
\o Resetting statistical vars
\o 
\o *Info*    Setting parameter values ...
\o 
\o Setting var temperature = "27"
\o Setting temp(T) = 27
\o 
\o *Info*    Netlist Directory =
\o           /home/saul/simulation/BANDGAP/BG_0_6_V3/adexl/results/data/MonteCarlo.7/19/MC/groupRunDataDir/netlist
\o 
\o 
\o *Info*    Data Directory    =
\o           /home/saul/simulation/BANDGAP/BG_0_6_V3/adexl/results/data/MonteCarlo.7/19/MC/groupRunDataDir
\o 
\o 
\o *Info*    Creating Netlist for Point ID (3 19)
\o 
\w *WARNING* (DB-220704): The Pcell super master 'lf11is/rnpolyh/schematic' is not a SKILL super master.
\w                        The usage of non-SKILL Pcells in Virtuoso is not a supported feature.
\w *WARNING* (DB-220704): The Pcell super master 'lf11is/rnpolyh/schematic' is not a SKILL super master.
\w                        The usage of non-SKILL Pcells in Virtuoso is not a supported feature.
\w *WARNING* (DB-220704): The Pcell super master 'lf11is/rnpolyh/schematic' is not a SKILL super master.
\w                        The usage of non-SKILL Pcells in Virtuoso is not a supported feature.
\w *WARNING* (DB-220704): The Pcell super master 'lf11is/rnpolyh/schematic' is not a SKILL super master.
\w                        The usage of non-SKILL Pcells in Virtuoso is not a supported feature.
\w *WARNING* (DB-220704): The Pcell super master 'lf11is/rnpolyh/schematic' is not a SKILL super master.
\w                        The usage of non-SKILL Pcells in Virtuoso is not a supported feature.
\w *WARNING* (CMGR-6145): Cannot refresh 'ci:0x0' because it is not a valid constraint cache. Rerun the 'ciRefreshCellView' SKILL function with a valid constraint cache.
\o generate netlist...
\o Loading hnlInit.cxt 
\o Loading seCore.cxt 
\# [15:24:44.132736] periodic Lic check successful
\# [15:24:44.132738] Feature usage summary:
\o Begin Incremental Netlisting Oct 14 15:24:44 2025
\o End netlisting Oct 14 15:24:44 2025
\o 
\o 	The netlist is up to date.
\o 	Time taken to compare the design with netlist:   0.0s
\o       ...successful.
\o compose simulator input file...
\o       ...successful.
\o 
\o *Info*    Running simulation on testbench [ MC ] for Point ID (3 19).
\o 
\o *Info*    Spectre controlMode is set "batch" due to monte carlo run.
\o 
\o Delete psf data in /home/saul/simulation/BANDGAP/BG_0_6_V3/adexl/results/data/MonteCarlo.7/19/MC/groupRunDataDir/psf.
\o generate netlist...
\o Begin Incremental Netlisting Oct 14 15:24:45 2025
\o End netlisting Oct 14 15:24:45 2025
\o 
\o 	The netlist is up to date.
\o 	Time taken to compare the design with netlist:   0.0s
\o       ...successful.
\o compose simulator input file...
\o       ...successful.
\o start simulator if needed...
\o       ...successful.
\o simulate...
\o To view the simulator output, right-click on the test name, result 
\o name, or any value in the "Results" tab of the Outputs section and 
\o choose "Output Log" menu option.
\o Loading paraplot.cxt 
\# Memory report: Maximum memory size now 19,356 MB at UTC 2025.10.14 15:24:50.252
\o *Info*    Client has finished evaluating ... 
\o 
\o 
\o *Info*    Run complete for Point ID (3 19) on testbench [ MC ].
\o 
\o 
\o 
\o 
\o 
\# Available memory:         18,019 MB at UTC 2025.10.14 15:25:00.346
\# Memory report: Maximum memory size now 18,491 MB at UTC 2025.10.14 15:25:00.346
\o *Info*    Client has finished evaluating ... 
\o 
\o 
\o *Info*    Run complete for Point ID (3 20) on testbench [ MC ].
\o 
\o 
\o 
\o 
\o 
\# Memory report: using         473 MB, process size 2,366 MB at UTC 2025.10.14 15:25:03.294
\o *Info*    Client has finished evaluating ... 
\o 
\o 
\o *Info*    Run complete for Point ID (3 21) on testbench [ MC ].
\o 
\o 
\o 
\o 
\o 
\o *Info*    Client has finished evaluating ... 
\o 
\o 
\o *Info*    Run complete for Point ID (3 22) on testbench [ MC ].
\o 
\o 
\o 
\o 
\o 
\o INFO (ADE-3071): Simulation completed successfully.
\o reading simulation data...
\o       ...successful.
\o *Info*    Client has finished evaluating ... 
\o 
\o 
\o *Info*    Run complete for Point ID (3 23) on testbench [ MC ].
\o 
\o 
\o 
\o 
\o 
\o *Info*    Client has finished evaluating ... 
\o 
\o 
\o *Info*    Run complete for Point ID (3 24) on testbench [ MC ].
\o 
\o 
\o 
\o 
\o 
\o *Info*    Client has finished evaluating ... 
\o 
\o 
\o *Info*    Run complete for Point ID (3 25) on testbench [ MC ].
\o 
\o 
\o 
\o 
\o 
\o *Info*    Client has finished evaluating ... 
\o 
\o 
\o *Info*    Run complete for Point ID (3 26) on testbench [ MC ].
\o 
\o 
\o 
\o 
\o 
\o *Info*    Client has finished evaluating ... 
\o 
\o 
\o *Info*    Run complete for Point ID (3 27) on testbench [ MC ].
\o 
\o 
\o 
\o 
\o 
\o *Info*    Monte Carlo Simulation completed successfully...
\o Simulation design variables differ from those on the cellView,
\o they have been saved in the file "/tmp/saved-design-variables".
\o To save future changes, copy variables to cellView before exiting.
\o 
\o 
\o *Info*    Configuring the session ...
\o 
\o 	Library      = BANDGAP
\o 	Cell         = BG_0_6_V3
\o 	View         = schematic
\o 	Simulator    = spectre
\o 	State Path   = $AXL_SETUPDB_DIR/test_states
\o 	State Name   = MC_BANDGAP:BG_0_8_V2:1:1_state_MonteCarlo.8
\o 	Results DB   = /home/saul/projects/LF_BG/BANDGAP/BG_0_6_V3/adexl/results/data/MonteCarlo.8.rdb
\o 	Results Dir  = /home/saul/simulation/BANDGAP/BG_0_6_V3/adexl/results/data/MonteCarlo.8/1/MC
\o 	Results Loc  = /home/saul/simulation/BANDGAP/BG_0_6_V3/adexl/results/data
\o 	Project Dir  = /home/saul/simulation
\o 	Setup DB loc = /home/saul/projects/LF_BG/BANDGAP/BG_0_6_V3/adexl
\o 	File Encoding = 0
\o 
\o 
\o 
\o *Info*    The auto suspension is disabled.
\o 
\o 
\o 
\o 
\o 
\o 
\o *Info*    Run start for Point ID (4 91) on testbench [ MC ].
\o 
\o Resetting statistical vars
\o 
\o *Info*    Setting parameter values ...
\o 
\o Setting var temperature = "27"
\o Setting temp(T) = 27
\o 
\o *Info*    Netlist Directory =
\o           /home/saul/simulation/BANDGAP/BG_0_6_V3/adexl/results/data/MonteCarlo.8/91/MC/groupRunDataDir/netlist
\o 
\o 
\o *Info*    Data Directory    =
\o           /home/saul/simulation/BANDGAP/BG_0_6_V3/adexl/results/data/MonteCarlo.8/91/MC/groupRunDataDir
\o 
\o 
\o *Info*    Creating Netlist for Point ID (4 91)
\o 
\o generate netlist...
\o Begin Incremental Netlisting Oct 14 15:25:58 2025
\o Loading json.cxt 
\o End netlisting Oct 14 15:25:58 2025
\o 
\o Netlisting Statistics:
\o 	Number of components:   35
\o 
\o 	Elapsed time:          1.0s (35.00/s)
\o Errors: 0	Warnings: 0
\o       ...successful.
\o compose simulator input file...
\o       ...successful.
\# Memory report: Maximum memory size now 19,025 MB at UTC 2025.10.14 15:26:00.647
\o 
\o *Info*    Running simulation on testbench [ MC ] for Point ID (4 91).
\o 
\o *Info*    Spectre controlMode is set "batch" due to monte carlo run.
\o 
\o Delete psf data in /home/saul/simulation/BANDGAP/BG_0_6_V3/adexl/results/data/MonteCarlo.8/91/MC/groupRunDataDir/psf.
\o generate netlist...
\o Begin Incremental Netlisting Oct 14 15:26:00 2025
\o End netlisting Oct 14 15:26:00 2025
\o 
\o 	The netlist is up to date.
\o 	Time taken to compare the design with netlist:   0.0s
\o       ...successful.
\o compose simulator input file...
\o       ...successful.
\o start simulator if needed...
\o       ...successful.
\o simulate...
\o To view the simulator output, right-click on the test name, result 
\o name, or any value in the "Results" tab of the Outputs section and 
\o choose "Output Log" menu option.
\# Memory report: Maximum memory size now 18,646 MB at UTC 2025.10.14 15:26:16.416
\o *Info*    Client has finished evaluating ... 
\o 
\o 
\o *Info*    Run complete for Point ID (4 91) on testbench [ MC ].
\o 
\o 
\o 
\o 
\o 
\o *Info*    Client has finished evaluating ... 
\o 
\o 
\o *Info*    Run complete for Point ID (4 92) on testbench [ MC ].
\o 
\o 
\o 
\o 
\o 
\o INFO (ADE-3071): Simulation completed successfully.
\o reading simulation data...
\o       ...successful.
\o *Info*    Client has finished evaluating ... 
\o 
\o 
\o *Info*    Run complete for Point ID (4 93) on testbench [ MC ].
\o 
\o 
\o 
\o 
\o 
\o *Info*    Client has finished evaluating ... 
\o 
\o 
\o *Info*    Run complete for Point ID (4 94) on testbench [ MC ].
\o 
\o 
\o 
\o 
\o 
\o *Info*    Client has finished evaluating ... 
\o 
\o 
\o *Info*    Run complete for Point ID (4 95) on testbench [ MC ].
\o 
\o 
\o 
\o 
\o 
\o *Info*    Client has finished evaluating ... 
\o 
\o 
\o *Info*    Run complete for Point ID (4 96) on testbench [ MC ].
\o 
\o 
\o 
\o 
\o 
\o *Info*    Client has finished evaluating ... 
\o 
\o 
\o *Info*    Run complete for Point ID (4 97) on testbench [ MC ].
\o 
\o 
\o 
\o 
\o 
\o *Info*    Client has finished evaluating ... 
\o 
\o 
\o *Info*    Run complete for Point ID (4 98) on testbench [ MC ].
\o 
\o 
\o 
\o 
\o 
\o *Info*    Client has finished evaluating ... 
\o 
\o 
\o *Info*    Run complete for Point ID (4 99) on testbench [ MC ].
\o 
\o 
\o 
\o 
\o 
\o *Info*    Monte Carlo Simulation completed successfully...
\o Simulation design variables differ from those on the cellView,
\o they have been saved in the file "/tmp/saved-design-variables".
\o To save future changes, copy variables to cellView before exiting.
\o 
\o 
\o *Info*    Configuring the session ...
\o 
\o 	Library      = BANDGAP
\o 	Cell         = BG_0_6_V3
\o 	View         = schematic
\o 	Simulator    = spectre
\o 	State Path   = $AXL_SETUPDB_DIR/test_states
\o 	State Name   = MC_BANDGAP:BG_0_8_V2:1:1_state_MonteCarlo.9
\o 	Results DB   = /home/saul/projects/LF_BG/BANDGAP/BG_0_6_V3/adexl/results/data/MonteCarlo.9.rdb
\o 	Results Dir  = /home/saul/simulation/BANDGAP/BG_0_6_V3/adexl/results/data/MonteCarlo.9/1/MC
\o 	Results Loc  = /home/saul/simulation/BANDGAP/BG_0_6_V3/adexl/results/data
\o 	Project Dir  = /home/saul/simulation
\o 	Setup DB loc = /home/saul/projects/LF_BG/BANDGAP/BG_0_6_V3/adexl
\o 	File Encoding = 0
\o 
\o 
\o 
\o *Info*    The auto suspension is disabled.
\o 
\o 
\o 
\o 
\o 
\o 
\o *Info*    Run start for Point ID (5 28) on testbench [ MC ].
\o 
\o Resetting statistical vars
\o 
\o *Info*    Setting parameter values ...
\o 
\o Setting var temperature = "27"
\o Setting temp(T) = 27
\o 
\o *Info*    Netlist Directory =
\o           /home/saul/simulation/BANDGAP/BG_0_6_V3/adexl/results/data/MonteCarlo.9/28/MC/groupRunDataDir/netlist
\o 
\o 
\o *Info*    Data Directory    =
\o           /home/saul/simulation/BANDGAP/BG_0_6_V3/adexl/results/data/MonteCarlo.9/28/MC/groupRunDataDir
\o 
\o 
\o *Info*    Creating Netlist for Point ID (5 28)
\o 
\o generate netlist...
\o Begin Incremental Netlisting Oct 14 15:29:01 2025
\o End netlisting Oct 14 15:29:02 2025
\o 
\o Netlisting Statistics:
\o 	Number of components:   35
\o 
\o 	Elapsed time:          1.0s (35.00/s)
\o Errors: 0	Warnings: 0
\o       ...successful.
\o compose simulator input file...
\o       ...successful.
\o 
\o *Info*    Running simulation on testbench [ MC ] for Point ID (5 28).
\o 
\o *Info*    Spectre controlMode is set "batch" due to monte carlo run.
\o 
\o Delete psf data in /home/saul/simulation/BANDGAP/BG_0_6_V3/adexl/results/data/MonteCarlo.9/28/MC/groupRunDataDir/psf.
\o generate netlist...
\o Begin Incremental Netlisting Oct 14 15:29:04 2025
\o End netlisting Oct 14 15:29:04 2025
\o 
\o 	The netlist is up to date.
\o 	Time taken to compare the design with netlist:   0.0s
\o       ...successful.
\o compose simulator input file...
\o       ...successful.
\o start simulator if needed...
\o       ...successful.
\o simulate...
\o To view the simulator output, right-click on the test name, result 
\o name, or any value in the "Results" tab of the Outputs section and 
\o choose "Output Log" menu option.
\o *Info*    Client has finished evaluating ... 
\o 
\o 
\o *Info*    Run complete for Point ID (5 28) on testbench [ MC ].
\o 
\o 
\o 
\o 
\o 
\o *Info*    Client has finished evaluating ... 
\o 
\o 
\o *Info*    Run complete for Point ID (5 29) on testbench [ MC ].
\o 
\o 
\o 
\o 
\o 
\o INFO (ADE-3071): Simulation completed successfully.
\o reading simulation data...
\o       ...successful.
\o *Info*    Client has finished evaluating ... 
\o 
\o 
\o *Info*    Run complete for Point ID (5 30) on testbench [ MC ].
\o 
\o 
\o 
\o 
\o 
\o *Info*    Client has finished evaluating ... 
\o 
\o 
\o *Info*    Run complete for Point ID (5 31) on testbench [ MC ].
\o 
\o 
\o 
\o 
\o 
\o *Info*    Client has finished evaluating ... 
\o 
\o 
\o *Info*    Run complete for Point ID (5 32) on testbench [ MC ].
\o 
\o 
\o 
\o 
\o 
\o *Info*    Client has finished evaluating ... 
\o 
\o 
\o *Info*    Run complete for Point ID (5 33) on testbench [ MC ].
\o 
\o 
\o 
\o 
\o 
\o *Info*    Client has finished evaluating ... 
\o 
\o 
\o *Info*    Run complete for Point ID (5 34) on testbench [ MC ].
\o 
\o 
\o 
\o 
\o 
\o *Info*    Client has finished evaluating ... 
\o 
\o 
\o *Info*    Run complete for Point ID (5 35) on testbench [ MC ].
\o 
\o 
\o 
\o 
\o 
\o *Info*    Client has finished evaluating ... 
\o 
\o 
\o *Info*    Run complete for Point ID (5 36) on testbench [ MC ].
\o 
\o 
\o 
\o 
\o 
\o *Info*    Monte Carlo Simulation completed successfully...
\o Simulation design variables differ from those on the cellView,
\o they have been saved in the file "/tmp/saved-design-variables".
\o To save future changes, copy variables to cellView before exiting.
\o 
\o 
\o *Info*    Configuring the session ...
\o 
\o 	Library      = BANDGAP
\o 	Cell         = BG_0_6_V3
\o 	View         = schematic
\o 	Simulator    = spectre
\o 	State Path   = $AXL_SETUPDB_DIR/test_states
\o 	State Name   = MC_BANDGAP:BG_0_8_V2:1:1_state_MonteCarlo.10
\o 	Results DB   = /home/saul/projects/LF_BG/BANDGAP/BG_0_6_V3/adexl/results/data/MonteCarlo.10.rdb
\o 	Results Dir  = /home/saul/simulation/BANDGAP/BG_0_6_V3/adexl/results/data/MonteCarlo.10/1/MC
\o 	Results Loc  = /home/saul/simulation/BANDGAP/BG_0_6_V3/adexl/results/data
\o 	Project Dir  = /home/saul/simulation
\o 	Setup DB loc = /home/saul/projects/LF_BG/BANDGAP/BG_0_6_V3/adexl
\o 	File Encoding = 0
\o 
\o 
\o 
\o *Info*    The auto suspension is disabled.
\o 
\o 
\o 
\o 
\o 
\o 
\o *Info*    Run start for Point ID (6 91) on testbench [ MC ].
\o 
\o Resetting statistical vars
\o 
\o *Info*    Setting parameter values ...
\o 
\o Setting var temperature = "27"
\o Setting temp(T) = 27
\o 
\o *Info*    Netlist Directory =
\o           /home/saul/simulation/BANDGAP/BG_0_6_V3/adexl/results/data/MonteCarlo.10/91/MC/groupRunDataDir/netlist
\o 
\o 
\o *Info*    Data Directory    =
\o           /home/saul/simulation/BANDGAP/BG_0_6_V3/adexl/results/data/MonteCarlo.10/91/MC/groupRunDataDir
\o 
\o 
\o *Info*    Creating Netlist for Point ID (6 91)
\o 
\o generate netlist...
\o Begin Incremental Netlisting Oct 14 15:31:22 2025
\o End netlisting Oct 14 15:31:22 2025
\o 
\o 	The netlist is up to date.
\o 	Time taken to compare the design with netlist:   0.0s
\o       ...successful.
\o compose simulator input file...
\o       ...successful.
\o 
\o *Info*    Running simulation on testbench [ MC ] for Point ID (6 91).
\o 
\o *Info*    Spectre controlMode is set "batch" due to monte carlo run.
\o 
\o Delete psf data in /home/saul/simulation/BANDGAP/BG_0_6_V3/adexl/results/data/MonteCarlo.10/91/MC/groupRunDataDir/psf.
\o generate netlist...
\o Begin Incremental Netlisting Oct 14 15:31:24 2025
\o End netlisting Oct 14 15:31:24 2025
\o 
\o 	The netlist is up to date.
\o 	Time taken to compare the design with netlist:   0.0s
\o       ...successful.
\o compose simulator input file...
\o       ...successful.
\o start simulator if needed...
\o       ...successful.
\o simulate...
\o To view the simulator output, right-click on the test name, result 
\o name, or any value in the "Results" tab of the Outputs section and 
\o choose "Output Log" menu option.
\# Memory report: Maximum memory size now 18,067 MB at UTC 2025.10.14 15:31:40.127
\o *Info*    Client has finished evaluating ... 
\o 
\o 
\o *Info*    Run complete for Point ID (6 91) on testbench [ MC ].
\o 
\o 
\o 
\o 
\o 
\o *Info*    Client has finished evaluating ... 
\o 
\o 
\o *Info*    Run complete for Point ID (6 92) on testbench [ MC ].
\o 
\o 
\o 
\o 
\o 
\o INFO (ADE-3071): Simulation completed successfully.
\o reading simulation data...
\o       ...successful.
\o *Info*    Client has finished evaluating ... 
\o 
\o 
\o *Info*    Run complete for Point ID (6 93) on testbench [ MC ].
\o 
\o 
\o 
\o 
\o 
\o *Info*    Client has finished evaluating ... 
\o 
\o 
\o *Info*    Run complete for Point ID (6 94) on testbench [ MC ].
\o 
\o 
\o 
\o 
\o 
\o *Info*    Client has finished evaluating ... 
\o 
\o 
\o *Info*    Run complete for Point ID (6 95) on testbench [ MC ].
\o 
\o 
\o 
\o 
\o 
\o *Info*    Client has finished evaluating ... 
\o 
\o 
\o *Info*    Run complete for Point ID (6 96) on testbench [ MC ].
\o 
\o 
\o 
\o 
\o 
\o *Info*    Client has finished evaluating ... 
\o 
\o 
\o *Info*    Run complete for Point ID (6 97) on testbench [ MC ].
\o 
\o 
\o 
\o 
\o 
\o *Info*    Client has finished evaluating ... 
\o 
\o 
\o *Info*    Run complete for Point ID (6 98) on testbench [ MC ].
\o 
\o 
\o 
\o 
\o 
\o *Info*    Client has finished evaluating ... 
\o 
\o 
\o *Info*    Run complete for Point ID (6 99) on testbench [ MC ].
\o 
\o 
\o 
\o 
\o 
\o *Info*    Monte Carlo Simulation completed successfully...
\o Simulation design variables differ from those on the cellView,
\o they have been saved in the file "/tmp/saved-design-variables".
\o To save future changes, copy variables to cellView before exiting.
\o 
\o 
\o *Info*    Configuring the session ...
\o 
\o 	Library      = BANDGAP
\o 	Cell         = BG_0_6_V3
\o 	View         = schematic
\o 	Simulator    = spectre
\o 	State Path   = $AXL_SETUPDB_DIR/test_states
\o 	State Name   = MC_BANDGAP:BG_0_8_V2:1:1_state_MonteCarlo.11
\o 	Results DB   = /home/saul/projects/LF_BG/BANDGAP/BG_0_6_V3/adexl/results/data/MonteCarlo.11.rdb
\o 	Results Dir  = /home/saul/simulation/BANDGAP/BG_0_6_V3/adexl/results/data/MonteCarlo.11/1/MC
\o 	Results Loc  = /home/saul/simulation/BANDGAP/BG_0_6_V3/adexl/results/data
\o 	Project Dir  = /home/saul/simulation
\o 	Setup DB loc = /home/saul/projects/LF_BG/BANDGAP/BG_0_6_V3/adexl
\o 	File Encoding = 0
\o 
\o 
\o 
\o *Info*    The auto suspension is disabled.
\o 
\o 
\o 
\o 
\o 
\o 
\o *Info*    Run start for Point ID (7 91) on testbench [ MC ].
\o 
\o Resetting statistical vars
\o 
\o *Info*    Setting parameter values ...
\o 
\o Setting var temperature = "27"
\o Setting temp(T) = 27
\o 
\o *Info*    Netlist Directory =
\o           /home/saul/simulation/BANDGAP/BG_0_6_V3/adexl/results/data/MonteCarlo.11/91/MC/groupRunDataDir/netlist
\o 
\o 
\o *Info*    Data Directory    =
\o           /home/saul/simulation/BANDGAP/BG_0_6_V3/adexl/results/data/MonteCarlo.11/91/MC/groupRunDataDir
\o 
\o 
\o *Info*    Creating Netlist for Point ID (7 91)
\o 
\o generate netlist...
\o Begin Incremental Netlisting Oct 14 15:33:26 2025
\o End netlisting Oct 14 15:33:27 2025
\o 
\o 	The netlist is up to date.
\o 	Time taken to compare the design with netlist:   1.0s
\o       ...successful.
\o compose simulator input file...
\o       ...successful.
\o 
\o *Info*    Running simulation on testbench [ MC ] for Point ID (7 91).
\o 
\o *Info*    Spectre controlMode is set "batch" due to monte carlo run.
\o 
\o Delete psf data in /home/saul/simulation/BANDGAP/BG_0_6_V3/adexl/results/data/MonteCarlo.11/91/MC/groupRunDataDir/psf.
\o generate netlist...
\o Begin Incremental Netlisting Oct 14 15:33:28 2025
\o End netlisting Oct 14 15:33:28 2025
\o 
\o 	The netlist is up to date.
\o 	Time taken to compare the design with netlist:   0.0s
\o       ...successful.
\o compose simulator input file...
\o       ...successful.
\o start simulator if needed...
\o       ...successful.
\o simulate...
\o To view the simulator output, right-click on the test name, result 
\o name, or any value in the "Results" tab of the Outputs section and 
\o choose "Output Log" menu option.
\# Memory report: Maximum memory size now 17,704 MB at UTC 2025.10.14 15:33:43.940
\o *Info*    Client has finished evaluating ... 
\o 
\o 
\o *Info*    Run complete for Point ID (7 91) on testbench [ MC ].
\o 
\o 
\o 
\o 
\o 
\o *Info*    Client has finished evaluating ... 
\o 
\o 
\o *Info*    Run complete for Point ID (7 92) on testbench [ MC ].
\o 
\o 
\o 
\o 
\o 
\o INFO (ADE-3071): Simulation completed successfully.
\o reading simulation data...
\o       ...successful.
\o *Info*    Client has finished evaluating ... 
\o 
\o 
\o *Info*    Run complete for Point ID (7 93) on testbench [ MC ].
\o 
\o 
\o 
\o 
\o 
\# Memory report: using         575 MB, process size 2,467 MB at UTC 2025.10.14 15:33:50.304
\o *Info*    Client has finished evaluating ... 
\o 
\o 
\o *Info*    Run complete for Point ID (7 94) on testbench [ MC ].
\o 
\o 
\o 
\o 
\o 
\o *Info*    Client has finished evaluating ... 
\o 
\o 
\o *Info*    Run complete for Point ID (7 95) on testbench [ MC ].
\o 
\o 
\o 
\o 
\o 
\o *Info*    Client has finished evaluating ... 
\o 
\o 
\o *Info*    Run complete for Point ID (7 96) on testbench [ MC ].
\o 
\o 
\o 
\o 
\o 
\o *Info*    Client has finished evaluating ... 
\o 
\o 
\o *Info*    Run complete for Point ID (7 97) on testbench [ MC ].
\o 
\o 
\o 
\o 
\o 
\o *Info*    Client has finished evaluating ... 
\o 
\o 
\o *Info*    Run complete for Point ID (7 98) on testbench [ MC ].
\o 
\o 
\o 
\o 
\o 
\o *Info*    Client has finished evaluating ... 
\o 
\o 
\o *Info*    Run complete for Point ID (7 99) on testbench [ MC ].
\o 
\o 
\o 
\o 
\o 
\o *Info*    Monte Carlo Simulation completed successfully...
\o Simulation design variables differ from those on the cellView,
\o they have been saved in the file "/tmp/saved-design-variables".
\o To save future changes, copy variables to cellView before exiting.
\o 
\o 
\o *Info*    Configuring the session ...
\o 
\o 	Library      = BANDGAP
\o 	Cell         = BG_0_6_V3
\o 	View         = schematic
\o 	Simulator    = spectre
\o 	State Path   = $AXL_SETUPDB_DIR/test_states
\o 	State Name   = COR_spectre_state1_MonteCarlo.12
\o 	Results DB   = /home/saul/projects/LF_BG/BANDGAP/BG_0_6_V3/adexl/results/data/MonteCarlo.12.rdb
\o 	Results Dir  = /home/saul/simulation/BANDGAP/BG_0_6_V3/adexl/results/data/MonteCarlo.12/1/COR
\o 	Results Loc  = /home/saul/simulation/BANDGAP/BG_0_6_V3/adexl/results/data
\o 	Project Dir  = /home/saul/simulation
\o 	Setup DB loc = /home/saul/projects/LF_BG/BANDGAP/BG_0_6_V3/adexl
\o 	File Encoding = 0
\o 
\o 
\o 
\o *Info*    The auto suspension is disabled.
\o 
\o 
\o 
\o 
\o 
\o 
\o *Info*    Run start for Point ID (8 91) on testbench [ COR ].
\o 
\o Resetting statistical vars
\o 
\o *Info*    Setting parameter values ...
\o 
\o Setting var temperature = "27"
\o Setting temp(T) = 27
\o 
\o *Info*    Netlist Directory =
\o           /home/saul/simulation/BANDGAP/BG_0_6_V3/adexl/results/data/MonteCarlo.12/91/COR/groupRunDataDir/netlist
\o 
\o 
\o *Info*    Data Directory    =
\o           /home/saul/simulation/BANDGAP/BG_0_6_V3/adexl/results/data/MonteCarlo.12/91/COR/groupRunDataDir
\o 
\o 
\o *Info*    Creating Netlist for Point ID (8 91)
\o 
\o generate netlist...
\o Begin Incremental Netlisting Oct 14 15:34:42 2025
\o End netlisting Oct 14 15:34:43 2025
\o 
\o Netlisting Statistics:
\o 	Number of components:   35
\o 
\o 	Elapsed time:          1.0s (35.00/s)
\o Errors: 0	Warnings: 0
\o       ...successful.
\o compose simulator input file...
\o       ...successful.
\o 
\o *Info*    Running simulation on testbench [ COR ] for Point ID (8 91).
\o 
\o *Info*    Spectre controlMode is set "batch" due to monte carlo run.
\o 
\o Delete psf data in /home/saul/simulation/BANDGAP/BG_0_6_V3/adexl/results/data/MonteCarlo.12/91/COR/groupRunDataDir/psf.
\o generate netlist...
\o Begin Incremental Netlisting Oct 14 15:34:44 2025
\o End netlisting Oct 14 15:34:45 2025
\o 
\o 	The netlist is up to date.
\o 	Time taken to compare the design with netlist:   1.0s
\o       ...successful.
\o compose simulator input file...
\o       ...successful.
\o start simulator if needed...
\o       ...successful.
\o simulate...
\o To view the simulator output, right-click on the test name, result 
\o name, or any value in the "Results" tab of the Outputs section and 
\o choose "Output Log" menu option.
\o *Info*    Current simulation for points ((8 91) (8 92) (8 93) (8 94)
\o           (8 95) (8 96) (8 97) (8 98) (8 99)).
\o *Info*    (ADE-3072): Simulation stopped because you selected the
\o           'Stop Simulation' command in ADE.
\o 
\o *Info*    Monte Carlo Simulation unsuccessful...
\o *Info*    See simulation output log for more information.
\o ERROR (ADE-3036): Errors encountered during simulation. The simulator run log has not been generated.
\o         Possible cause could be an invalid command line option for the version of the simulator
\o         you are running. Choose Setup->Environment and verify that the command line options
\o         specified in the userCmdLineOption field are supported for the simulator.
\o         Alternatively, run the simulator standalone using the runSimulation file in the netlist
\o         directory to know the exact cause of the error.
\o Simulation design variables differ from those on the cellView,
\o they have been saved in the file "/tmp/saved-design-variables".
\o To save future changes, copy variables to cellView before exiting.
\# Lic Summary:
\# [15:39:46.368971] Cdslmd servers:3000@lic08.ug.kth.se
\# [15:39:46.369331] Feature usage summary:
\# Memory report: on exit            593 MB, process size 2,486 MB at UTC 2025.10.14 15:39:46.369
\# Memory report: peak usage         593 MB, process size 2,486 MB
